{
  "schema": "codecks.autonomous-maturity.source-inventory.v1",
  "method": {
    "scope": "tracked *.kt, *.java, and *.swift files from git ls-files",
    "line_definition": "Python str.splitlines physical lines; blank and comment lines included",
    "generated_policy": "tracked build/generated sources are separate; untracked build outputs are excluded",
    "classification": "path/source-set rules in tools/evidence/generate_autonomous_maturity_source_inventory.py"
  },
  "summary": {
    "file_count": 514,
    "physical_lines": 89718,
    "by_category": {
      "build_definition": 22,
      "companion": 3699,
      "debug_only": 5,
      "internal_lab": 2474,
      "public_production": 53791,
      "tests": 29727
    },
    "by_source_set": {
      "android_androidTest": 660,
      "android_androidTestDebug": 484,
      "android_androidTestPlay": 462,
      "android_androidTestPlayInternal": 61,
      "android_debug": 5,
      "android_main": 53599,
      "android_play_internal": 2474,
      "android_play_production_dark": 192,
      "android_test": 23742,
      "android_testPlay": 243,
      "android_testPlayInternal": 1791,
      "backend_main": 868,
      "backend_test": 721,
      "mac_helper": 1598,
      "mac_helper_package_manifest": 22,
      "mac_helper_tests": 808,
      "shared_commonMain": 1233,
      "shared_commonTest": 755
    },
    "by_language": {
      "Java": 918,
      "Kotlin": 86372,
      "Swift": 2428
    }
  },
  "files": [
    {
      "path": "app/src/androidTest/java/io/codecks/release/HidSystemEventInstrumentedTest.kt",
      "category": "tests",
      "source_set": "android_androidTest",
      "feature_owner": "release/HidSystemEventInstrumentedTest.kt",
      "language": "Kotlin",
      "physical_lines": 46,
      "sha256": "8306e65bc5becc186fa26a3118b1607849d225dd04ea215e6ff24304083f77a0"
    },
    {
      "path": "app/src/androidTest/java/io/codecks/release/ReleaseSshSmokeInstrumentedTest.kt",
      "category": "tests",
      "source_set": "android_androidTest",
      "feature_owner": "release/ReleaseSshSmokeInstrumentedTest.kt",
      "language": "Kotlin",
      "physical_lines": 193,
      "sha256": "284bf4883cb86fd7a7999982062d6fcef2ce102371b0d5b924f68c178928a48d"
    },
    {
      "path": "app/src/androidTest/java/io/codecks/ui/app/MainActivityStartupInstrumentedTest.kt",
      "category": "tests",
      "source_set": "android_androidTest",
      "feature_owner": "ui/app",
      "language": "Kotlin",
      "physical_lines": 30,
      "sha256": "dac3b2750df8a0df47a1a2adae174cc77655a5e6625c09d1ec0ff70f7d93e18f"
    },
    {
      "path": "app/src/androidTest/java/io/codecks/ui/mouse/RawTrackpadViewInstrumentedTest.kt",
      "category": "tests",
      "source_set": "android_androidTest",
      "feature_owner": "ui/mouse",
      "language": "Kotlin",
      "physical_lines": 306,
      "sha256": "3c1b3e6800bb226704b02b2703a5f9b1b2c6c770e7b87a6c05c5886f17c18bf0"
    },
    {
      "path": "app/src/androidTest/java/io/codecks/ui/mouse/lockscreen/LockscreenEntryInstrumentedTest.kt",
      "category": "tests",
      "source_set": "android_androidTest",
      "feature_owner": "ui/mouse",
      "language": "Kotlin",
      "physical_lines": 49,
      "sha256": "63b8a361eaca8fac238d95227f8b315b1b4a04e35477bfc08ca11839ee18c64b"
    },
    {
      "path": "app/src/androidTest/java/io/codecks/ui/settings/SettingsConnectionParityInstrumentedTest.kt",
      "category": "tests",
      "source_set": "android_androidTest",
      "feature_owner": "ui/settings",
      "language": "Kotlin",
      "physical_lines": 36,
      "sha256": "69e51bc43c71085c39cd7d526a7e9ace2e3a7b7a7ebc1037ef0f7991a812967c"
    },
    {
      "path": "app/src/androidTestDebug/java/io/codecks/data/ConnectionTargetIdentityInstrumentedTest.kt",
      "category": "tests",
      "source_set": "android_androidTestDebug",
      "feature_owner": "data/ConnectionTargetIdentityInstrumentedTest.kt",
      "language": "Kotlin",
      "physical_lines": 59,
      "sha256": "a01da13f2520f232c22f3cff6fe24925473f5a997dea5f6ff4b6fa2bff1594a1"
    },
    {
      "path": "app/src/androidTestDebug/java/io/codecks/data/smart/SmartContextRepositoryTest.kt",
      "category": "tests",
      "source_set": "android_androidTestDebug",
      "feature_owner": "data/smart",
      "language": "Kotlin",
      "physical_lines": 62,
      "sha256": "de3314d72a697b6c311b6cdbe2a98ba02f770e2740cc7ce69b9f053633a8e6e1"
    },
    {
      "path": "app/src/androidTestDebug/java/io/codecks/release/AccessibilityRuntimeInstrumentedTest.kt",
      "category": "tests",
      "source_set": "android_androidTestDebug",
      "feature_owner": "release/AccessibilityRuntimeInstrumentedTest.kt",
      "language": "Kotlin",
      "physical_lines": 75,
      "sha256": "d23e5b9d55e0b0452b0ed1808a428067e4a7682169a6356259becd85ef17eb24"
    },
    {
      "path": "app/src/androidTestDebug/java/io/codecks/ui/app/AccessibleStatusComposeInstrumentedTest.kt",
      "category": "tests",
      "source_set": "android_androidTestDebug",
      "feature_owner": "ui/app",
      "language": "Kotlin",
      "physical_lines": 59,
      "sha256": "43c1e432821827004fd8283ed5449c096a0f0e25a29bacf0676ee35d841ef9f4"
    },
    {
      "path": "app/src/androidTestDebug/java/io/codecks/ui/mouse/MouseScreenGestureInstrumentedTest.kt",
      "category": "tests",
      "source_set": "android_androidTestDebug",
      "feature_owner": "ui/mouse",
      "language": "Kotlin",
      "physical_lines": 229,
      "sha256": "3a30b83cdaa32aa41ec00151df5191ffd0249c967640cef6e9162eb26bf4ea77"
    },
    {
      "path": "app/src/androidTestPlay/java/io/codecks/commercialproof/ManagedCommercialDarkInstrumentedTest.kt",
      "category": "tests",
      "source_set": "android_androidTestPlay",
      "feature_owner": "commercialproof/ManagedCommercialDarkInstrumentedTest.kt",
      "language": "Kotlin",
      "physical_lines": 372,
      "sha256": "bb6d53a1155d22560af056a2c651c736528a24ba6050f7cf024716223ae01a65"
    },
    {
      "path": "app/src/androidTestPlay/java/io/codecks/commercialproof/ManagedCommercialProofReceipt.kt",
      "category": "tests",
      "source_set": "android_androidTestPlay",
      "feature_owner": "commercialproof/ManagedCommercialProofReceipt.kt",
      "language": "Kotlin",
      "physical_lines": 90,
      "sha256": "ff63659257d02833018fe5009cdae8d51c4415ecd69d4151d1b6d4985e255118"
    },
    {
      "path": "app/src/androidTestPlayInternal/java/io/codecks/internalcommercial/labui/CommercialLabActivityTest.kt",
      "category": "tests",
      "source_set": "android_androidTestPlayInternal",
      "feature_owner": "internalcommercial/labui",
      "language": "Kotlin",
      "physical_lines": 61,
      "sha256": "eae7d3697fccbb8cd464921ef854b1071651586cbe0050844a33016c4266fda9"
    },
    {
      "path": "app/src/debug/java/io/codecks/GestureTestActivity.kt",
      "category": "debug_only",
      "source_set": "android_debug",
      "feature_owner": "root",
      "language": "Kotlin",
      "physical_lines": 5,
      "sha256": "139e46c81fa4cf44a5b521de86d0a597646524b03c797c6296771b082c7cf647"
    },
    {
      "path": "app/src/main/java/io/codecks/CodecksApplication.kt",
      "category": "public_production",
      "source_set": "android_main",
      "feature_owner": "root",
      "language": "Kotlin",
      "physical_lines": 24,
      "sha256": "1810b681d4d01afd073589f23df916a63c15eb9174c8fa32ba289581cc799280"
    },
    {
      "path": "app/src/main/java/io/codecks/HidController.java",
      "category": "public_production",
      "source_set": "android_main",
      "feature_owner": "root",
      "language": "Java",
      "physical_lines": 796,
      "sha256": "84e02d9c6fab8a7446982685cdc02f1a601498df51471fe63ce1f315b07e0c06"
    },
    {
      "path": "app/src/main/java/io/codecks/HidReports.java",
      "category": "public_production",
      "source_set": "android_main",
      "feature_owner": "root",
      "language": "Java",
      "physical_lines": 122,
      "sha256": "e727bacb82ef9697a04690e1e3828858b199746dabe402d295ad4eacd4789d86"
    },
    {
      "path": "app/src/main/java/io/codecks/HidRepository.kt",
      "category": "public_production",
      "source_set": "android_main",
      "feature_owner": "root",
      "language": "Kotlin",
      "physical_lines": 1198,
      "sha256": "f45418d9d9d1fcb0fa8b9825c0424d8e65b0bfb720b21f6e37549569d46ae195"
    },
    {
      "path": "app/src/main/java/io/codecks/HidSessionService.kt",
      "category": "public_production",
      "source_set": "android_main",
      "feature_owner": "root",
      "language": "Kotlin",
      "physical_lines": 254,
      "sha256": "c8bac0ec927e1a445155cb7351515df21427a61e74c81a4335ac17c496a3a8ea"
    },
    {
      "path": "app/src/main/java/io/codecks/IntentDestinationPolicy.kt",
      "category": "public_production",
      "source_set": "android_main",
      "feature_owner": "root",
      "language": "Kotlin",
      "physical_lines": 44,
      "sha256": "200d1c4e62ab84b37f363aa577e82d63a745ce2cb5f7449c7425b5371189626b"
    },
    {
      "path": "app/src/main/java/io/codecks/MainActivity.kt",
      "category": "public_production",
      "source_set": "android_main",
      "feature_owner": "root",
      "language": "Kotlin",
      "physical_lines": 2234,
      "sha256": "0dc43d38d4b6aefc9ee29e4deb4222872d418e3af9cf869fb37e40ed4bbd799c"
    },
    {
      "path": "app/src/main/java/io/codecks/core/actions/ActionContracts.kt",
      "category": "public_production",
      "source_set": "android_main",
      "feature_owner": "core/actions",
      "language": "Kotlin",
      "physical_lines": 161,
      "sha256": "871f619dce1725ad6638b8eeef7de31905f8f9f2a89226bb5a80dfaa4baadcfc"
    },
    {
      "path": "app/src/main/java/io/codecks/core/actions/AiDraftConverters.kt",
      "category": "public_production",
      "source_set": "android_main",
      "feature_owner": "core/actions",